{
  "schemaVersion": 1,
  "datasetId": "dsh-memory-lifecycle-scripted",
  "datasetVersion": "1.0.0",
  "referenceCommit": "f32fbd7846ddf5c5130c5bb696c695b56b9d70a8",
  "provenance": {
    "mode": "scripted",
    "interpretation": "pipeline-conformance-only",
    "adapter": "deterministic-script-adapter-v1",
    "externalNetwork": false,
    "modelQualityClaim": false
  },
  "cases": [
    {
      "id": "op-zh-supersede-tp",
      "language": "zh",
      "role": "conformance",
      "faultScenario": "nominal",
      "owner": {
        "tenantId": "tenant-lifecycle",
        "userId": "user-op-zh-supersede-tp",
        "agentId": "assistant"
      },
      "sessionId": "op-zh-supersede-tp-primary",
      "content": "用户：北极星项目现在改为十一月上线。",
      "idempotencyKey": "op-zh-supersede-tp-extract",
      "setup": [
        {
          "alias": "old",
          "content": "北极星项目将在十月上线。",
          "layer": "l2_fact"
        }
      ],
      "modelScript": [
        {
          "phase": "extraction",
          "outcome": "json",
          "payload": {
            "basicProfilePatch": {},
            "facts": [
              {
                "clientRef": "new-memory",
                "content": "北极星项目现在改为十一月上线。",
                "layer": "l2_fact",
                "tags": [
                  "生命周期"
                ],
                "confidence": 0.95,
                "evidenceTurnIndexes": [
                  1
                ]
              }
            ],
            "identities": []
          }
        },
        {
          "phase": "reconciliation",
          "outcome": "json",
          "payload": {
            "operations": [
              {
                "type": "SUPERSEDE",
                "sourceRef": "new-memory",
                "targetAliases": [
                  "old"
                ],
                "content": "北极星项目将在十一月上线。",
                "reason": "当前上线月份已变更。"
              }
            ]
          }
        }
      ],
      "measurements": {
        "conflict": true,
        "duplicate": false,
        "degradation": true
      },
      "expected": {
        "operation": "SUPERSEDE",
        "targetAliases": [
          "old"
        ],
        "receiptStatus": "completed"
      }
    },
    {
      "id": "op-zh-supersede-fn",
      "language": "zh",
      "role": "metric_sentinel",
      "faultScenario": "nominal",
      "owner": {
        "tenantId": "tenant-lifecycle",
        "userId": "user-op-zh-supersede-fn",
        "agentId": "assistant"
      },
      "sessionId": "op-zh-supersede-fn-primary",
      "content": "用户：我现在更喜欢远程办公。",
      "idempotencyKey": "op-zh-supersede-fn-extract",
      "setup": [
        {
          "alias": "old",
          "content": "用户更喜欢到办公室办公。",
          "layer": "l4_identity"
        }
      ],
      "modelScript": [
        {
          "phase": "extraction",
          "outcome": "json",
          "payload": {
            "basicProfilePatch": {},
            "facts": [],
            "identities": [
              {
                "clientRef": "new-memory",
                "content": "用户现在更喜欢远程办公。",
                "layer": "l4_identity",
                "tags": [
                  "生命周期"
                ],
                "confidence": 0.95,
                "evidenceTurnIndexes": [
                  1
                ]
              }
            ]
          }
        },
        {
          "phase": "reconciliation",
          "outcome": "json",
          "payload": {
            "operations": [
              {
                "type": "ADD",
                "sourceRef": "new-memory"
              }
            ]
          }
        }
      ],
      "measurements": {
        "conflict": true,
        "duplicate": false,
        "degradation": true
      },
      "expected": {
        "operation": "SUPERSEDE",
        "targetAliases": [
          "old"
        ],
        "receiptStatus": "completed"
      }
    },
    {
      "id": "op-zh-add-tn",
      "language": "zh",
      "role": "conformance",
      "faultScenario": "nominal",
      "owner": {
        "tenantId": "tenant-lifecycle",
        "userId": "user-op-zh-add-tn",
        "agentId": "assistant"
      },
      "sessionId": "op-zh-add-tn-primary",
      "content": "用户：我的航班是周五上午九点。",
      "idempotencyKey": "op-zh-add-tn-extract",
      "setup": [],
      "modelScript": [
        {
          "phase": "extraction",
          "outcome": "json",
          "payload": {
            "basicProfilePatch": {},
            "facts": [
              {
                "clientRef": "new-memory",
                "content": "用户的航班是周五上午九点。",
                "layer": "l2_fact",
                "tags": [
                  "生命周期"
                ],
                "confidence": 0.95,
                "evidenceTurnIndexes": [
                  1
                ]
              }
            ],
            "identities": []
          }
        },
        {
          "phase": "reconciliation",
          "outcome": "json",
          "payload": {
            "operations": [
              {
                "type": "ADD",
                "sourceRef": "new-memory"
              }
            ]
          }
        }
      ],
      "measurements": {
        "conflict": true,
        "duplicate": false,
        "degradation": true
      },
      "expected": {
        "operation": "ADD",
        "targetAliases": [],
        "receiptStatus": "completed"
      }
    },
    {
      "id": "op-zh-duplicate-exact",
      "language": "zh",
      "role": "conformance",
      "faultScenario": "nominal",
      "owner": {
        "tenantId": "tenant-lifecycle",
        "userId": "user-op-zh-duplicate-exact",
        "agentId": "assistant"
      },
      "sessionId": "op-zh-duplicate-exact-primary",
      "content": "用户：我喜欢喝无糖拿铁。",
      "idempotencyKey": "op-zh-duplicate-exact-extract",
      "setup": [
        {
          "alias": "old",
          "content": "用户喜欢喝无糖拿铁。",
          "layer": "l4_identity"
        },
        {
          "alias": "distractor",
          "content": "用户喜欢在下午喝绿茶。",
          "layer": "l4_identity"
        }
      ],
      "modelScript": [
        {
          "phase": "extraction",
          "outcome": "json",
          "payload": {
            "basicProfilePatch": {},
            "facts": [],
            "identities": [
              {
                "clientRef": "new-memory",
                "content": "用户喜欢喝无糖拿铁。",
                "layer": "l4_identity",
                "tags": [
                  "生命周期"
                ],
                "confidence": 0.95,
                "evidenceTurnIndexes": [
                  1
                ]
              }
            ]
          }
        },
        {
          "phase": "reconciliation",
          "outcome": "json",
          "payload": {
            "operations": [
              {
                "type": "NOOP",
                "sourceRef": "new-memory",
                "duplicateAlias": "old"
              }
            ]
          }
        }
      ],
      "measurements": {
        "conflict": true,
        "duplicate": true,
        "degradation": true
      },
      "expected": {
        "operation": "NOOP",
        "targetAliases": [
          "old"
        ],
        "duplicateTargetAlias": "old",
        "receiptStatus": "completed"
      }
    },
    {
      "id": "op-zh-duplicate-paraphrase",
      "language": "zh",
      "role": "conformance",
      "faultScenario": "nominal",
      "owner": {
        "tenantId": "tenant-lifecycle",
        "userId": "user-op-zh-duplicate-paraphrase",
        "agentId": "assistant"
      },
      "sessionId": "op-zh-duplicate-paraphrase-primary",
      "content": "用户：发布窗口仍然定在十月。",
      "idempotencyKey": "op-zh-duplicate-paraphrase-extract",
      "setup": [
        {
          "alias": "old",
          "content": "产品计划在十月发布。",
          "layer": "l2_fact"
        }
      ],
      "modelScript": [
        {
          "phase": "extraction",
          "outcome": "json",
          "payload": {
            "basicProfilePatch": {},
            "facts": [
              {
                "clientRef": "new-memory",
                "content": "产品的发布月份是十月。",
                "layer": "l2_fact",
                "tags": [
                  "生命周期"
                ],
                "confidence": 0.95,
                "evidenceTurnIndexes": [
                  1
                ]
              }
            ],
            "identities": []
          }
        },
        {
          "phase": "reconciliation",
          "outcome": "json",
          "payload": {
            "operations": [
              {
                "type": "NOOP",
                "sourceRef": "new-memory",
                "duplicateAlias": "old"
              }
            ]
          }
        }
      ],
      "measurements": {
        "conflict": true,
        "duplicate": true,
        "degradation": true
      },
      "expected": {
        "operation": "NOOP",
        "targetAliases": [
          "old"
        ],
        "duplicateTargetAlias": "old",
        "receiptStatus": "completed"
      }
    },
    {
      "id": "op-zh-consolidate-tn",
      "language": "zh",
      "role": "conformance",
      "faultScenario": "nominal",
      "owner": {
        "tenantId": "tenant-lifecycle",
        "userId": "user-op-zh-consolidate-tn",
        "agentId": "assistant"
      },
      "sessionId": "op-zh-consolidate-tn-primary",
      "content": "用户：北极星项目定于十月十五日上线。",
      "idempotencyKey": "op-zh-consolidate-tn-extract",
      "setup": [
        {
          "alias": "month",
          "content": "北极星项目在十月上线。",
          "layer": "l2_fact"
        },
        {
          "alias": "day",
          "content": "北极星项目在十五日上线。",
          "layer": "l2_fact"
        }
      ],
      "modelScript": [
        {
          "phase": "extraction",
          "outcome": "json",
          "payload": {
            "basicProfilePatch": {},
            "facts": [
              {